{
  "schemaVersion": "1.0.0-draft",
  "mediaType": "application/vnd.agentsuite.manifest.v1+json",
  "name": "minimal",
  "agents": [
    {
      "id": "writer",
      "path": "agents/writer.json",
      "digest": "sha256:722b2eab9ec38613f8d5598d99075a576c3bbecaef6695e5b244818e40a306d3"
    }
  ],
  "toolCatalog": {
    "id": "catalog",
    "path": "tools/catalog.json",
    "digest": "sha256:98aefca0842f347cca9b9143f0b39f7d1edf8c6a5f0d091afcc805ecfb507a1c"
  },
  "compositions": [
    {
      "agent": "writer",
      "platform": {
        "os": "linux",
        "architecture": "amd64"
      },
      "path": "compositions/writer-linux-amd64.json",
      "digest": "sha256:d42dae10d5c1154ca9fbdde41cc70881690f1e54c29fa8a6ff0e9c0444f38a63"
    }
  ],
  "buildProfiles": [
    {
      "id": "default",
      "path": "build-profiles/default.json",
      "digest": "sha256:83201c5185d01b9099e5c74eae58460f613c4a41e27375c8b1d9051325a01084"
    }
  ],
  "capabilities": [],
  "extensions": []
}
